Titre,Prix,Vote,Lien_Image
"ASUS TUF Gaming F16 (2025) Gaming Laptop, 16” FHD+ 165Hz IPS-Level 16:10 Display, Intel® Core™ i7 Processor 14650HX, NVIDIA® GeForce RTX™ 5050, 16GB DDR5, 1TB PCIe Gen4 SSD, Wi-Fi 6E, Windows 11 Home",734211.0,4.8,https://m.media-amazon.com/images/I/71cjDQIKaPL._AC_UY218_.jpg
"Titan 18 HX Dragon Edition Norse Myth 18"" 120Hz MiniLED UHD+ Gaming Laptop: Intel Ultra 9-285HX, NVIDIA Geforce RTX 5090, 96GB DDR5, 6TB SSD, Thunderbolt 5, Wi-Fi 7, Win 11 Pro: Black A2XWJG-440US",,,https://m.media-amazon.com/images/I/81Hhaje1UzL._AC_UY218_.jpg
"Lenovo IdeaPad Slim 3X - 2025 - Everyday AI Laptop - Copilot+ PC - 15.3"" WUXGA Display - 16 GB Memory - 512 GB Storage - Qualcomm® Snapdragon® X - Luna Grey",325003.0,4.3,https://m.media-amazon.com/images/I/71nYpJKrGNL._AC_UY218_.jpg
"Laptop 32GB RAM 1TB SSD, Gold Pentium Processor (Up to 3.4GHz), 14 Inch IPS FHD Display, 38WH, USB3.2, Type-C, HDMI, WiFi 5, Win11 Laptop, Notebook Laptops for Business and Students",176183.0,5.0,https://m.media-amazon.com/images/I/61kvVM7uEaL._AC_UY218_.jpg
"Laptop, 32GB RAM 1TB SSD Laptop Computer, 6500Y Processor (Beats N5095, Up to 3.4GHz), 15.6 inch FHD IPS Display, Type-C, HDMI, WiFi 5, BT 5.2, Laptops for Student, Business, Travel",181891.0,5.0,https://m.media-amazon.com/images/I/61NWHv4OlLL._AC_UY218_.jpg
"Lenovo IdeaPad Slim 3X - 2025 - Everyday AI Laptop - Copilot+ PC - 15.3"" WUXGA Display - 16 GB Memory - 512 GB Storage - Qualcomm® Snapdragon® X - Luna Grey",325003.0,4.3,https://m.media-amazon.com/images/I/71nYpJKrGNL._AC_UY218_.jpg
"HP Victus 15.6"" Full HD 144Hz Gaming Laptop, Intel Core i5-12450H, NVIDIA GeForce RTX 3050,16GB RAM, 512GB PCIe SSD, Wi-Fi 6, Backlit Keyboard,Windows 11 Pro, Performance Blue",,4.4,https://m.media-amazon.com/images/I/71cZs6fmSfL._AC_UY218_.jpg
"Microsoft Surface Laptop Go 3 (2023) - 12.4"" Touchscreen, Thin & Lightweight, Intel Core i5, 8GB RAM, 256GB SSD SSD, with Windows 11, Platinum Color Microsoft Copilot",,4.5,https://m.media-amazon.com/images/I/61GqSlHr41L._AC_UY218_.jpg
"ASUS ExpertBook PM3 14” Business Laptop, AMD Ryzen AI7 350 Processor, 32GB RAM, 1TB SSD, WiFi 7, Windows 11 Pro, Misty Grey, PM3406CKA-XS76",701328.0,5.0,https://m.media-amazon.com/images/I/71WUZFvMzAL._AC_UY218_.jpg
"ASUS Vivobook Laptop, 14"" FHD Display, i3-1215U, 16GB RAM, 512GB SSD, Wi-Fi 6, HDMI, Webcam, Touchpad, Windows 11 Home, Blue",210400.0,4.3,https://m.media-amazon.com/images/I/61jojpe4KVL._AC_UY218_.jpg
"Lenovo IdeaPad Slim 3 15.6"" FHD Touchscreen Laptop, AMD Ryzen 7 7730U, 16GB RAM, 1TB SSD, Backlit Keyboard, WiFi, HDMI, Bluetooth, Windows 11, Arctic Grey",,5.0,https://m.media-amazon.com/images/I/61wN9SXgQeL._AC_UY218_.jpg
"Lenovo IdeaPad Slim 3 15.6"" Full HD Touchscreen Laptop – AMD Ryzen 7 5825U, 16GB Memory, 512GB SSD, Arctic Grey",274826.0,4.3,https://m.media-amazon.com/images/I/61JTN1n+JQL._AC_UY218_.jpg
"Lenovo IdeaPad Touchscreen Laptop, 15.6"" FHD (1920x1080) IPS 300nits Anti-Glare Display, AMD Ryzen 5 7520U, 8GB LPDDR5RAM, 512GB SSD, AMD Radeon Graphics, Windows 11 Home, Abyss Blue, EAT 16GB USB PEN",225225.0,5.0,https://m.media-amazon.com/images/I/71w7HfmM5bL._AC_UY218_.jpg
"LG gram Pro 17-inch Lightweight Laptop Computer, Intel Evo Edition Powered by Intel Core Ultra7 255H Processor, NVIDIA RTX5050, Windows 11 Home, 32GB RAM, 2TB SSD, Black",1366740.0,4.5,https://m.media-amazon.com/images/I/617zFnvYNlL._AC_UY218_.jpg
"Gaming Laptop, 16 inch Laptop Computer 2026 with Windows 11 Pro, 16GB RAM 1TB SSD, Int 13th Gen N150 Processor(up to 3.6GHz), Backlit Keyboard, Bluetooth, Mini HDMI, Office 365, FHD 1080P",,4.2,https://m.media-amazon.com/images/I/71tO7BSaVHL._AC_UY218_.jpg
"ASUS Vivobook S 14 OLED Slim Laptop, AMD Ryzen AI 9 365(10 Cores), 24GB, 1TB SSD, Customizable RGB Keyboard, Cool Silver, M5406WA-AH94",558780.0,4.3,https://m.media-amazon.com/images/I/61tsMYfb38L._AC_UY218_.jpg
"Lenovo Legion Pro 7i Gen 10 16"" Gaming Laptop (2025 Model) Intel Core Ultra 9 275HX 24C, NVIDIA GeForce RTX 5090 24GB, 64GB RAM, 2TB (1TB+1TB) NVMe SSD, 16"" WQXGA OLED 500 nits 240Hz, Windows 11 Home",,4.9,https://m.media-amazon.com/images/I/515W50hwJmL._AC_UY218_.jpg
"Microsoft Surface Laptop 6 for Business AI PC 13.5"", Windows 11 Pro, Intel Core Ultra 7, 16GB, 256GB SSD, Black",,,https://m.media-amazon.com/images/I/51l1Dvj-5fL._AC_UY218_.jpg
"Dell 14 Plus Laptop DB14250-14-inch 16:10 2.5K (2560x1600) Display, Intel Core Ultra 7-258V, 32GB LPDDR5X RAM, 1TB SSD, Arc Graphics, Backlit Copilot Key Keyboard - Previously Inspiron",,4.2,https://m.media-amazon.com/images/I/71XP9wOi1fL._AC_UY218_.jpg
"msi Crosshair 18 HX AI 18"" 2560x1600 240Hz Display Gaming Laptop, Intel Core Ultra 9 275HX (24 Cores, 2.1-5.4 GHz), NVIDIA RTX 5070 8GB GDDR7, 32GB RAM, 1TB NVMe SSD, Windows 11 Home",1014932.0,4.6,https://m.media-amazon.com/images/I/71thHr+GZNL._AC_UY218_.jpg
"HP OmniBook X Flip 2-in-1 Laptop 14"" WUXGA IPS Touchscreen 8-Core AMD Ryzen AI 7 350 24GB LPDDR5 1TB SSD AMD Radeon 860M Graphics Wi-Fi 6E Backlit Keyboard Win11 Home W/Mouse",553079.0,4.4,https://m.media-amazon.com/images/I/71gp0stp8hL._AC_UY218_.jpg
"Lenovo Legion 5i – AI-Powered Gaming Laptop - Intel® Core™ i7-13650HX - 15"" 2K WUXGA IPS Display – 4.9GHz – NVIDIA® GeForce RTX™ 5050 – 16GB Memory – 512GB Storage – Eclipse Black",622094.0,4.4,https://m.media-amazon.com/images/I/71Qmg0W9QuL._AC_UY218_.jpg
"ASUS Zenbook Duo Laptop, Dual 14” OLED 3K 120Hz Touch Display, Evo, Intel Core Ultra 9 285H, Intel Arc Graphics, 32GB RAM, 1TB SSD, Windows 11, UX8406CA-PS99T",1020469.0,4.5,https://m.media-amazon.com/images/I/71VUFrGHwDL._AC_UY218_.jpg
"Laptop, 32GB RAM 512GB SSD Laptops Computer, 6500Y Processor (Beats N5095 up to 3.4GHz), 15.6"" FHD IPS Display Win11 Laptop PC for Student and Business, WiFi 5, BT 5.0, Sliver",,4.0,https://m.media-amazon.com/images/I/61aJ5UrozjL._AC_UY218_.jpg
"15.6"" Laptop Computer, Laptop with 16GB RAM 512B SSD, Gold 6500Y (Up to 3.4GHz), 1080P FHD IPS Display, Type-C, HDMI, USB3.2, WIFI, Bluetooth, Long Battery Life, Laptops for Business & Student",,4.8,https://m.media-amazon.com/images/I/71QXt+DXSlL._AC_UY218_.jpg
"Microsoft Surface Laptop for Business (2025) Windows 11 Pro Copilot+ PC, 15"" Qualcomm Snapdragon X Elite, 16 GB RAM, 512 GB SSD Storage, Black",,4.0,https://m.media-amazon.com/images/I/61D-qwf2OOL._AC_UY218_.jpg
"Dell 14 Plus Laptop DB14250-14-inch 16:10 2.5K (2560x1600) Display, Intel Core Ultra 7-258V, 32GB LPDDR5X RAM, 1TB SSD, Arc Graphics, Backlit Copilot Key Keyboard - Previously Inspiron",,4.2,https://m.media-amazon.com/images/I/71XP9wOi1fL._AC_UY218_.jpg
"Dell 16 Laptop Computer, Intel Core 7 150U Processor, 16"" FHD+ IPS Touchscreen Anti-Glare Display, 32GB DDR5 RAM, 1TB PCIe SSD, WiFi 6E, Bluetooth 5.3, Backlit Keyboard, Windows 11 Home",,4.6,https://m.media-amazon.com/images/I/813QHoKFcVL._AC_UY218_.jpg
"Dell Inspiron 14 i5440 Business Laptop 2024, 14"" WUXGA IPS, Intel i5-1334U 10-Core, Iris Xe Graphics, 16GB DDR5 1TB SSD, Backlit Keyboard, Wi-Fi 6, Card Reader, Win11 Pro, Carbon Black",,3.8,https://m.media-amazon.com/images/I/81mHreJh3JL._AC_UY218_.jpg
"ASUS ROG Strix G18 (2025) Gaming Laptop, 18” ROG FHD+ 16:10 144Hz, NVIDIA® GeForce RTX™ 5050, AMD Ryzen™ 9 8940HX Mobile Processor, 16GB DDR5-5200Mhz, 1TB SSD, Wi-Fi 6E, Wind 11 Home",798260.0,4.3,https://m.media-amazon.com/images/I/71aUQ0pgYGL._AC_UY218_.jpg
"HP 17.3"" Laptop, Full HD (1920 * 1080) Display, AMD Ryzen 5 Processor (Beats i7-11370H), 16GB RAM, 1TB SSD, Windows 11 Home, Webcam, Wi-Fi, Bluetooth, Natural Silver, Alpacatec Accessory",,4.2,https://m.media-amazon.com/images/I/81OmgXxs8wL._AC_UY218_.jpg
"HP - Victus 15.6"" Full HD 144Hz Gaming Laptop - Intel Core i5-13420H - 8GB Memory - NVIDIA GeForce RTX 3050-512GB SSD - Performance Blue",347246.0,4.3,https://m.media-amazon.com/images/I/71gfWwWhd4L._AC_UY218_.jpg
"HP Portable Laptop, Student and Business, 14"" HD Display, Intel Quad-Core N4120, 4GB DDR4 RAM, 64GB eMMC, 1 Year Office 365, Webcam, RJ-45, HDMI, Wi-Fi, Windows 11 Home, Silver",112892.0,4.3,https://m.media-amazon.com/images/I/61IpRGnny7L._AC_UY218_.jpg
"HP OmniBook X Flip 2-in-1 Laptop 14"" WUXGA IPS Touchscreen 8-Core AMD Ryzen AI 7 350 24GB LPDDR5 1TB SSD AMD Radeon 860M Graphics Wi-Fi 6E Backlit Keyboard Win11 Home W/Mouse",553079.0,4.4,https://m.media-amazon.com/images/I/71gp0stp8hL._AC_UY218_.jpg
"Dell 16 Touchscreen Laptop DC16251, Intel Core 7 150U(up to 5.4 GHz), 32GB DDR5, 1TB SSD, 16:10(1920 x 1200) 300 Nits Display, Fingerprint & Backlit KB, Win 11 Pro, Copilot Key, for Business & Student",,4.8,https://m.media-amazon.com/images/I/719lkvjF-tL._AC_UY218_.jpg
"DELL 13th Generation Business Inspiron 15 3530 Laptop, 15.6"" FHD Touchscreen, Intel Core i7-1355U, 32GB RAM, 1TB SSD, Webcam, HDMI, Wi-Fi 6, Windows 11 Pro, Black",,4.1,https://m.media-amazon.com/images/I/61XxMkA7EAL._AC_UY218_.jpg
"Apple 2025 MacBook Air 15-inch Laptop with M4 chip: Built for Apple Intelligence, 15.3"" Liquid Retina Display, 16GB Unified Memory, 256GB SSD Storage, 12MP Center Stage Camera, Touch ID, Starlight",,4.8,https://m.media-amazon.com/images/I/71QpE8YnbsL._AC_UY218_.jpg
"Alienware 16 Aurora Laptop AC16250-16-inch 16:10 WQXGA Display, Intel Core 7-240H Series 2, 16GB DDR5 RAM, 1TB SSD, NVIDIA GeForce RTX 5060 8GB GDDR7, Windows 11 Home, Onsite Service - Blue",,4.5,https://m.media-amazon.com/images/I/71LIpVe8h6L._AC_UY218_.jpg
"Dell 15 Laptop 15.6 inch FHD Touchscreen, Intel 10-Core i5-1334U 32GB RAM 1TB SSD, Intel UHD Graphics, Win 11 Pro Black for Business and College Students",,4.4,https://m.media-amazon.com/images/I/51ExaK0IkSL._AC_UY218_.jpg
"Lenovo ThinkBook 16 G7 Business Laptop 2026,16"" WUXGA Display, AMD Ryzen 5 7533HS (Beats i7-1255U), 16GB DDR5 RAM, 512GB PCIe SSD, Wi-Fi 6, Bluetooth, RJ-45, Webcam, Fingerprint Reader, Copilot W11Pro",324467.0,4.4,https://m.media-amazon.com/images/I/61J5a9zkWML._AC_UY218_.jpg
"HP 14"" HD Student Business Laptop, Intel Quad-Core N4120, 16GB RAM, 64GB eMMC, 1 Year Office 365, Slim Design, Webcam, HDMI, Bluetooth, WiFi, Win 11 S, White",141977.0,4.4,https://m.media-amazon.com/images/I/71AeqXGBx6L._AC_UY218_.jpg
"Lenovo 2026 New V15 Laptop for Student & Business, Powerful AMD Ryzen 3 7320U (Beat i7-1065G7), 15.6 inch FHD, 16GB RAM, 256GB SSD, Ethernet Port RJ-45, Windows 11 Pro, Long Battery Life, No Mouse",,4.4,https://m.media-amazon.com/images/I/71-kxE79skL._AC_UY218_.jpg
"ASUS Vivobook 14"" FHD Laptop, Intel Core i3-1315U Processor, 8GB RAM, 128GB SSD, Windows 11 Home, Intel UHD Graphics, Wi-Fi, Bluetooth, Quiet Blue, X1404VA-I38128",165349.0,4.0,https://m.media-amazon.com/images/I/51W04meGgAL._AC_UY218_.jpg
"HP OmniBook X FILP Copilot+ PC 16 inch 2K Touch 2-in-1 Touchs Laptop, AMD Ryzen AI 5 340, 16GB DDR5 RAM, 512GB SSD, Backlit KB, Copilot+ PC, Windows 11 Home, Meteor Silver, 16-ar0013dx",313034.0,4.6,https://m.media-amazon.com/images/I/51RYT38RA1L._AC_UY218_.jpg
"Lenovo Legion Pro 7i – AI-Powered Gaming Laptop – Intel® Core Ultra 7 255HX – 16"" WQXGA PureSight OLED Display – 240Hz – NVIDIA® GeForce RTX™ 5070 Ti – 32GB Memory – 2TB Storage – PC GamePass",,4.3,https://m.media-amazon.com/images/I/81SKqogPgCL._AC_UY218_.jpg
"Dell Inspiron 15 3525 Laptop, 15.6"" FHD Display, 16GB RAM,512GB SSD, AMD Ryzen 5 5500U Processor, AMD Radeon Graphics, SD Card Reader, WiFi, Bluetooth, Webcam, Windows 11 Home, Alpacatec Accessories",284525.0,,https://m.media-amazon.com/images/I/51XWNgVVF0L._AC_UY218_.jpg
"msi Thin 15 15.6” 144Hz FHD Gaming Laptop: Intel Core i7-13620H, NVIDIA Geforce RTX 4050, 16GB DDR4, 512GB NVMe SSD, WiFi 6E, Win 11: Black B13VE-2678US",,4.3,https://m.media-amazon.com/images/I/71MfZpnDWRL._AC_UY218_.jpg
"HP 17 Laptop, 17.3"" FHD Display, 32GB RAM, 1TB SSD, AMD Ryzen 5 Processor(Beats i7-1165G7, Up to 4.3GHz), Webcam, Numeric Keypad, Long Battery Life, Windows 11 Home, Alpacatec Accessories, Silver",,4.1,https://m.media-amazon.com/images/I/71v+60IGI6L._AC_UY218_.jpg
"Dell Pro 16 Laptop Computer, Intel Core Ultra 7 265U & AI for Business, 16"" Touch IPS Display, 32GB DDR5 RAM, 1TB PCIe SSD, WiFi 6E, Bluetooth 5.3, Backlit Keyboard, Windows 11 Pro",,4.4,https://m.media-amazon.com/images/I/81z0Mu9TN-L._AC_UY218_.jpg
"ASUS ROG Flow Z13 (2025) Gaming Laptop, 13” ROG Nebula 16:10 2.5K 180Hz/3ms, AMD Ryzen AI MAX+ 395, RDNA 3.5 Graphics, 128GB LPDDR5X 8000MHz, 1TB PCIe Gen 4 SSD, Wi-Fi 7, Win 11 Pro, GZ302EA-XS99",1596526.0,4.2,https://m.media-amazon.com/images/I/71oIJjlYwCL._AC_UY218_.jpg
"HP 2025 Laptop | OmniBook 5 | 16"" 1920 x 1200 Touch IPS | Intel-12 Core Ultra 7 255U | 16GB LPDDR5 | 1TB SSD | Windows 11 Home | Wi-Fi 6 - BT 5.4 - Backlit KB - 1080p + IR Camera - Glacier Silver",,3.0,https://m.media-amazon.com/images/I/71XOKEMVvtL._AC_UY218_.jpg
"Acer Aspire Go 15 AI Ready Laptop, 15.6"" FHD (1920 x 1080) IPS Display, AMD Ryzen 7 5825U, AMD Radeon Graphics, 16GB DDR4, 512GB PCIe Gen4 SSD, Wi-Fi 6, Windows 11 Home, AG15-42P-R3NB",306916.0,4.2,https://m.media-amazon.com/images/I/71FPI17lWZL._AC_UY218_.jpg
"HP 17 Laptop, 17.3"" HD+ Touchscreen Display, 12th Gen Intel Core i7-1255U, 64GB RAM, 2TB SSD, Webcam, HDMI, SuperSpeed USB Ports, Wi-Fi 6, Windows 11 Home, Silver",,4.2,https://m.media-amazon.com/images/I/71CGrFl8cjL._AC_UY218_.jpg
"HP OMEN Gaming Laptop, AMD Ryzen 9-8940HX, 32 GB DDR5 RAM, 1 TB PCIe SSD, 16"" 2K (1920x1200) 144Hz Display, Nvidia G-Force RTX 5060, Backlit Keyboard, W11 Pro, Shadow Black",,3.6,https://m.media-amazon.com/images/I/81pIukY57BL._AC_UY218_.jpg
ASUS 2026 Vivobook 14” FHD Laptop 10-Core Intel Core i5-1334U Iris Xe Graphics 12GB DDR4 256GB NVMe SSD USB-C w/DP WiFi AC BT Webcam HDMI1.4 Windows 11 Home w/RE USB,207829.0,4.4,https://m.media-amazon.com/images/I/514F-bCZpLL._AC_UY218_.jpg
"Dell 16 Plus Laptop DB16250-16.0-inch 16:10 2.5K (2560x1600) Display, Intel Core Ultra 9 288V, 32GB LPDDR5X Memory, 2TB SSD, Arc Graphics, Backlit Copilot Key Keyboard, Windows 11 Home",757783.0,4.1,https://m.media-amazon.com/images/I/71TrGVthuEL._AC_UY218_.jpg
"HP 17 Laptop, 17.3” HD+ Display, 11th Gen Intel Core i3-1125G4 Processor, 16GB RAM, 1TB SSD, Wi-Fi, HDMI, Webcam, Windows 11 Home, Silver",,4.4,https://m.media-amazon.com/images/I/71CDSpds6jL._AC_UY218_.jpg
"Lenovo 2026 V15 Laptop for Student & Business, AMD 7000 Series Ryzen CPU (Beats Intel i7-1160G7), 15.6"" FHD IPS Display, 16GB RAM, 256GB SSD, Ethernet Port RJ-45, Windows 11 Pro, WOWPC USB, No Mouse",,4.2,https://m.media-amazon.com/images/I/71tneVhEmbL._AC_UY218_.jpg
"Lenovo Laptop Computer for Business & Student, Intel Dual Core N4500 Processor, 15.6"" FHD, 8GB DDR4 RAM, 256GB PCIe SSD, WiFi 6, Bluetooth 5, Type-C, HDMI, Windows 11 Home",,4.1,https://m.media-amazon.com/images/I/71G7ARlzyGL._AC_UY218_.jpg
"DELL Inspiron 3520 15.6"" Touchscreen i7 Laptop, 15.6"" FHD Touchscreen, Intel Core i7-1255U, 32GB RAM, 1TB SSD, Numeric Keypad, Webcam, SD Card Reader, HDMI, Wi-Fi, Windows 11 Home, Black",421935.0,4.2,https://m.media-amazon.com/images/I/61W6039Mm5L._AC_UY218_.jpg
"msi Crosshair A16 HX 16” QHD+ 240Hz Gaming Laptop – AMD Ryzen 9 8940HX, NVIDIA GeForce RTX 5060, 16GB DDR5, 1TB NVMe SSD, Wi-Fi 6E, USB-C, Windows 11 D8WFKG-090US",894537.0,5.0,https://m.media-amazon.com/images/I/713DKBgz+2L._AC_UY218_.jpg
"acer Swift Go 14 Laptop | 14"" 1920 x 1200 Touch Display | Unlock AI Experiences | AMD Ryzen 7 8845HS Octa-Core Ryzen AI Capable Processor | 16GB LPDDR5X | 1TB PCIe Gen 4 SSD | SFG14-63T-R1F4",484662.0,4.1,https://m.media-amazon.com/images/I/71L9qvTonML._AC_UY218_.jpg
"Lenovo IdeaPad Laptop Computer - 20GB RAM - 1.2TB Storage - Intel Core | Microsoft Office 365 Included, 256GB SSD and 1TB Cloud Storage, Webcam, Windows 11 no Mouse | Essential Laptop",,4.1,https://m.media-amazon.com/images/I/71NvqDSi9sL._AC_UY218_.jpg
"Lenovo ThinkPad T14 Gen 5 Business Laptop 14"" FHD+ IPS, Intel Ultra 5 125U, 64GB DDR5 RAM, 1TB SSD, 5MP HD Webcam, Fingerprint, Backlit, Wi-Fi 6E, 2 Thunderbolt 4, AI PC, W11P, 3 Yr Wty",906574.0,4.4,https://m.media-amazon.com/images/I/71oyK+3eJnL._AC_UY218_.jpg
"Lenovo V15 Laptop, 15.6"" FHD Display, AMD Ryzen 5 5500U Hexa-core Processor (Beat Intel i7-1065G7), 16GB RAM, 512GB SSD, HDMI, RJ45, Numeric Keypad, Wi-Fi, Windows 11 Pro, Black",,4.4,https://m.media-amazon.com/images/I/71ucBPBJeoL._AC_UY218_.jpg
"Lenovo Ideapad 3 15.6"" FHD Chromebook, Intel Celeron N4500, 4GB RAM, 224GB Storage (64GB SSD+160GB Docking Station Set), Intel UHD Graphics, Full Size Keyboard, Chrome OS, Artic Gray",130574.0,4.4,https://m.media-amazon.com/images/I/814GpuXLYZL._AC_UY218_.jpg
"Lenovo IdeaPad 1 Student Laptop, Intel Dual Core Processor, 20GB RAM, 1TB SSD + 128GB eMMC, 15.6"" FHD Display, 1 Year Office 365, Windows 11 Home, Wi-Fi 6, Webcam, Bluetooth, SD Card Reader, Grey",,4.1,https://m.media-amazon.com/images/I/715Hn1Gcv7L._AC_UY218_.jpg
"HP 17 Laptop, 17.3” HD+ Display, 11th Gen Intel Core i3-1125G4 Processor, 32GB RAM, 1TB SSD, Wi-Fi, HDMI, Webcam, Windows 11 Home, Silver",,4.2,https://m.media-amazon.com/images/I/71kKQIGhFYL._AC_UY218_.jpg
"HP 15 inch Laptop, FHD Display, 12th Generation Intel Core i3-1215U, 8 GB RAM, 128 GB SSD, Intel UHD Graphics, Windows 11 Home in S Mode, 15-dy5599nr (2023)",205263.0,4.2,https://m.media-amazon.com/images/I/71jcs5zlkzL._AC_UY218_.jpg
"HP OmniBook 5 Flip 2-in-1 14"" FHD+ Touchscreen Laptop, Intel Core 7 150U, Intel Graphics,16GB DDR5, 512GB SSD, Copilot, Backlit Keyboard, Win 11 Pro, Silver",364346.0,4.8,https://m.media-amazon.com/images/I/61bNdlbL3wL._AC_UY218_.jpg
"ASUS Vivobook 18 Laptop, 18” WUXGA 144Hz Display, AMD Ryzen 7 260 with XDNA NPU, AMD Radeon Graphics, 32GB RAM, 1TB SSD, Quiet Blue, M1807HA-DB79",624923.0,4.4,https://m.media-amazon.com/images/I/61qbdWp0AgL._AC_UY218_.jpg
"HP 15.6"" FHD Touchscreen Business Laptop, Intel 10-Core i7-1355U(up to 5.0 GHz), 32 GB RAM, 1 TB SSD, Intel Iris Xe Graphics, Wi-Fi 6, HD Camera, HDMI, Fast Charge, Microsoft Copilot, Windows 11 Pro",,4.6,https://m.media-amazon.com/images/I/71k0pksnBKL._AC_UY218_.jpg
"ASUS ROG Strix G16 (2025) Gaming Laptop, 16” ROG Nebula 16:10 2.5K 240Hz/3ms, NVIDIA® GeForce RTX™ 5070, AMD Ryzen™ 9 9955HX Processor, 32GB DDR5-5600, 1TB PCIe Gen 4 SSD, Wi-Fi 6E, Windows 11 Home",1196829.0,4.7,https://m.media-amazon.com/images/I/81-nRPDH1BL._AC_UY218_.jpg
"Dell 15 Laptop DC15250-15.6-inch FHD (1920x1080) 120Hz Display, Intel Core i5-1334U Processor, 16GB DDR4 RAM, 512GB SSD, Intel UHD Graphics, Windows 11 Home, Onsite Service - Platinum Silver",336287.0,4.4,https://m.media-amazon.com/images/I/71I9chrFYFL._AC_UY218_.jpg
HP Victus 15.6 inch FHD 144Hz Gaming Laptop Intel Core i5-13420H NVIDIA GeForce RTX 4050 6GB - 16GB DDR4 512GB SSD Mica Silver (2024),,4.5,https://m.media-amazon.com/images/I/81obPsMhewL._AC_UY218_.jpg
"HP 15.6"" FHD Laptop, Intel Core i3-1215U, 8GB RAM, 256GB SSD, Silver, Windows 11 Home, 15-dy5131wm",172197.0,4.2,https://m.media-amazon.com/images/I/41--6OKDR1L._AC_UY218_.jpg
"HP 15.6"" Touchscreen Laptop, Intel Core i5 Processor, 16GB RAM, 512GB SSD, Numeric Keypad, Bluetooth, Wi-Fi, Long Battery Life, Windows 11 Home, Alpacatec Accessories, Silver",,4.4,https://m.media-amazon.com/images/I/81g+L4BZA7L._AC_UY218_.jpg
"acer Aspire Go 15 Laptop, 15.3"" WUXGA(1920 x 1200) IPS Display, Intel i5-1334U, 8GB DDR5 RAM, 256GB PCIe SSD, Windows 11 Home, Wi-Fi, Bluetooth, Steel Gray, AG15-51P-510U",205268.0,4.6,https://m.media-amazon.com/images/I/518dL+3bGzL._AC_UY218_.jpg
"Lenovo ThinkPad X1 Carbon Gen 13 Business AI Laptop, Intel Core Ultra 7 255U, 14"" FHD+ Touchscreen, 32GB DDR5, 1TB SSD, 1080p IR Camera, Fingerprint, Wi-Fi 6E, Win 11 Pro, Bundle with 7-in-1 USB-C Hub",,5.0,https://m.media-amazon.com/images/I/71DI+fyD8VL._AC_UY218_.jpg
"acer Aspire Premium Slim Laptop - 15.6"" Full HD IPS 1080P Display - AMD Ryzen 3 7330U Quad-Core Processor - 8GB RAM - 256GB NVMe SSD - Webcam - Wi-Fi 6 - Windows 11 - W/O Mouse",,4.4,https://m.media-amazon.com/images/I/71794poVn3L._AC_UY218_.jpg
"Lenovo ThinkPad E16 Business Laptop, 16"" FHD+ Anti-Glare Touchscreen, AMD Ryzen 5 7535U, 16GB DDR5, 512GB SSD, Wi-Fi 6E, Fingerprint, Backlit, Webcam, Windows 11 Pro, Bundle with 7-in-1 USB-C Hub",,4.2,https://m.media-amazon.com/images/I/61mhwzvq8tL._AC_UY218_.jpg
"HP 15.6"" Portable Laptop, HD Display, Intel Quad-Core N200 Processor, 16GB RAM, 128GB Storage, Wi-Fi 6, Webcam, HDMI, Numeric Keypad, Windows 11 Home, Silver",187593.0,4.1,https://m.media-amazon.com/images/I/713XTyObMWL._AC_UY218_.jpg
"HP Stream 14"" HD BrightView Laptop, Intel Celeron N150, 16GB RAM, 288GB Storage (128GB UFS + 160GB Docking Station Set), Intel UHD Graphics, 720p Webcam, Wi-Fi, 1 Year Office 365, Win 11 S, Silver",187587.0,4.2,https://m.media-amazon.com/images/I/71bg--zkvSL._AC_UY218_.jpg
"ASUS Vivobook Go 11.6” HD Slim Laptop, Intel Dual Core N4500, Intel Graphics, 4GB, 128GB, Windows 11 Home, SonicMaster, ErgoSense, Black, L210KA-ES04",114032.0,4.0,https://m.media-amazon.com/images/I/51xxONbwsvL._AC_UY218_.jpg
"acer Nitro V Gaming Laptop | Intel Core i9-13900H Processor | NVIDIA GeForce RTX 5060 Laptop GPU | 15.6"" FHD IPS 165Hz Display | 16GB DDR4 | 1TB Gen 4 SSD | Wi-Fi 6 | Backlit KB | ANV15-52-98KV",627203.0,4.3,https://m.media-amazon.com/images/I/71lgxJKQZVL._AC_UY218_.jpg
"Alienware 18 Area-51 Gaming Laptop AA18250-18.0"" WQXGA 300Hz 3ms Display, Intel Core Ultra 9 275HX, NVIDIA GeForce RTX 5080, 32GB 2x16GB DDR5, 2TB SSD, 2MP FHD IR Camera, Windows 11 Home",,4.2,https://m.media-amazon.com/images/I/71fP88COuvL._AC_UY218_.jpg
Lenovo IdeaPad 1i Laptop with Office 365 Home and Business • 1TB Cloud Storage and 128GB SSD • 8GB RAM • Intel Core • 14 Anti-Glare Screen • WiFi-6 • 11HR Battery • Windows 11 no Mouse,,4.1,https://m.media-amazon.com/images/I/71WLduKsLDL._AC_UY218_.jpg
HP 15.6 inch FHD Laptop | Intel Core i3-N305 Processor | Intel UHD Graphics| Fingerprint | Silver | 8GB RAM | 256GB SSD | Windows 11 Home | Bundle with 64GB USB Flash Drive,165355.0,4.1,https://m.media-amazon.com/images/I/617pp3O9rxL._AC_UY218_.jpg
"Microsoft Surface Laptop (2024), Windows 11 Copilot+ PC, 13.8"" Touchscreen Display, Snapdragon X Elite (12 core), 16GB RAM, 512GB SSD Storage, Platinum",598129.0,4.3,https://m.media-amazon.com/images/I/61qvPpMV2+L._AC_UY218_.jpg
"Laptop 32GB RAM 1TB SSD, Gold Pentium Processor (Up to 3.4GHz), 14 Inch IPS FHD Display, 38WH, USB3.2, Type-C, HDMI, WiFi 5, Win11 Laptop, Notebook Laptops for Business and Students",176183.0,5.0,https://m.media-amazon.com/images/I/61kvVM7uEaL._AC_UY218_.jpg
"Laptop, 32GB RAM 1TB SSD Laptop Computer, 6500Y Processor (Beats N5095, Up to 3.4GHz), 15.6 inch FHD IPS Display, Type-C, HDMI, WiFi 5, BT 5.2, Laptops for Student, Business, Travel",181891.0,5.0,https://m.media-amazon.com/images/I/61NWHv4OlLL._AC_UY218_.jpg
"HP Convertible 2-in-1 Chromebook in Blue 14"" Touch FHD Intel 4-Core up to 3.40GHz 4GB Ram 64GB Storage 4K Graphics Super-Fast WiFi Chrome OS (14b - Renewed)",,4.5,https://m.media-amazon.com/images/I/61OEt4ytx4L._AC_UY218_.jpg
"Lenovo 2026 New Generation Business and Student Laptop, Ryzen 3 7000-Series(Outperforms Intel i5-1235U), 16GB DDR5, 256GB PCIE, 15.6"" FHD Display, Ultra Quiet Design, Long Battery Life, Windows 11 Pro",,4.2,https://m.media-amazon.com/images/I/71TBegOCmuL._AC_UY218_.jpg
"HP 15.6"" Business Laptop, Free Microsoft Office 2024 Lifetime License, Copilot AI Chat, HD Touchscreen Display, Intel 6-Core i3-1215U 4.4 GHz, 16GB RAM, 1TB SSD, Long Battery Life, Windows 11 Pro",313599.0,4.1,https://m.media-amazon.com/images/I/71UQNKqfBDL._AC_UY218_.jpg
N/A,148244.0,5.0,https://m.media-amazon.com/images/I/61VITmwN+3L._AC_UL320_.jpg
N/A,205263.0,5.0,https://m.media-amazon.com/images/I/71gLvSPOVCL._AC_UL320_.jpg
N/A,,,https://m.media-amazon.com/images/I/71FPI17lWZL._AC_UL320_.jpg
"HP 14"" HD Laptop, Windows 11, Intel Celeron Dual-Core Processor Up to 2.60GHz, 4GB RAM, 64GB SSD, Webcam, Dale Pink (Renewed)",,4.3,https://m.media-amazon.com/images/I/61MGsq1ZVaL._AC_UY218_.jpg
"HP 15.6"" FHD Touch Laptop, Intel i5, 16GB RAM, 512GB SSD, Windows 11 Pro, Wi-Fi 6, Flagship Business Laptop Bundle with Docking Station – Natural Silver",,4.4,https://m.media-amazon.com/images/I/71q45zEbcqL._AC_UY218_.jpg
"acer Nitro V 17 AI Gaming Laptop | AMD Ryzen 7 260 Processor | NVIDIA GeForce RTX 5070 Laptop GPU (798 AI Tops) | 17.3"" FHD IPS 144Hz Display | 32GB DDR5 | 1TB Gen 4 SSD | Wi-Fi 6E | ANV17-41-R75F",,4.2,https://m.media-amazon.com/images/I/719VOs+ZWlL._AC_UY218_.jpg
"HP Portable Laptop, Student and Business, 14"" HD Display, Intel Quad-Core N4120, 8GB DDR4 RAM, 64GB eMMC, 1 Year Office 365, Webcam, RJ-45, HDMI, Wi-Fi, Windows 11 Home, Silver",,4.2,https://m.media-amazon.com/images/I/61IpRGnny7L._AC_UY218_.jpg
"Microsoft Surface Laptop (2024), Windows 11 Copilot+ PC, 13.8"" Touchscreen Display, Snapdragon X Plus (10 core), 16GB RAM, 512GB SSD Storage, Black",672254.0,4.5,https://m.media-amazon.com/images/I/61Lt0OeCFZL._AC_UY218_.jpg
"GEEKOM GeekBook X16 Pro 2.8 lbs Laptop, 16"" IPS 2.5K 16:10 Laptop Computer, Ultra 9 185H, 32GB LPDDR5x 7500MHz RAM 2TB SSD, Up to 17 Hour, USB4, Fingerprint, Dual Fan, Copilot, Windows 11 Pro",,4.6,https://m.media-amazon.com/images/I/71iHXk9MSLL._AC_UY218_.jpg
"LG gram Pro 17-inch Lightweight Laptop Computer, Intel Evo Edition Powered by Intel Core Ultra7 255H Processor, NVIDIA RTX5050, Windows 11 Home, 32GB RAM, 2TB SSD, Black",1366740.0,4.5,https://m.media-amazon.com/images/I/617zFnvYNlL._AC_UY218_.jpg
"HP Chromebook 11A G8 Education Edition AMD A4-9120C 4GB DDR4-1866 SDRAM, 32GB eMMC 11.6-inch WLED HD Webcam Chrome OS (Renewed)",,4.1,https://m.media-amazon.com/images/I/81LUKMXGZJL._AC_UY218_.jpg
"HP New Core i7 15.6"" Laptop | 2026 Edition | Intel High-Performance Core i7-1255U up to 4.7GHz | 16GB RAM - 512GB PCIe SSD | Webcam | FHD | Long Battery Life | Windows 11 | Business & Academic",,4.5,https://m.media-amazon.com/images/I/6133gyK8ClL._AC_UY218_.jpg
