Titre,Prix,Vote,Lien_Image
"Lenovo Laptop V15 for Business and Student (15.6"" FHD Anti-Glare, AMD Ryzen 5 7520U (> Intel i5-1235U), 16GB DDR5 RAM, 512GB SSD), Numeric Keypad, Webcam w/Shutter, Ethernet, Wi-Fi 6, HDMI, Win 11 Pro",,5.0,https://m.media-amazon.com/images/I/71K1+6HWb2L._AC_UY218_.jpg
"ASUS Zenbook A14; Copilot+ PC, Ultrathin Laptop, 14” WUXGA OLED, Snapdragon® X Processor, 16 GB Memory, 512GB SSD, Wi-Fi 6E, Zabriskie Beige, UX3407QA-DS52-CB",409967.0,3.8,https://m.media-amazon.com/images/I/71spqBtNXBL._AC_UY218_.jpg
"ASUS ROG Strix G16 Gaming Laptop, 165Hz Display, NVIDIA® GeForce RTX™ 4060, Intel Core i7-13650HX, 16GB DDR5, 1TB PCIe Gen4 SSD, Wi-Fi 6E, Windows 11, G614JV-AS74",766757.0,4.4,https://m.media-amazon.com/images/I/81GrCeuCzxL._AC_UY218_.jpg
"Lenovo 2025 ThinkPad T14s Gen 6 Copilot+ Laptop with AMD Ryzen AI 7 PRO 350 Processor, 14” WUXGA IPS 400-Nits Touchscreen Display, 32GB LPDDR5X-7500MT Memory, 1TB SSD, Wi-Fi 7, and Windows 11 Pro",761198.0,4.6,https://m.media-amazon.com/images/I/71cYuKSb7yL._AC_UY218_.jpg
"HP 14 Laptop Student Business 2025 Flagship Computer, AI Copilot, 4-Core 13th Gen Intel CPU, 16GB RAM 628GB Storage (128GB UFS+500GB Ext) 1-Yr Office 365 Long Battery HubxcelAccessory Win 11S Lavender",,4.2,https://m.media-amazon.com/images/I/71HOQvPw3sL._AC_UY218_.jpg
"Microsoft Surface Laptop 6 13.5"" Touchscreen Notebook - Intel Core Ultra 7 165H - 32 GB - 512 GB SSD - English Keyboard - Black",,4.4,https://m.media-amazon.com/images/I/51l1Dvj-5fL._AC_UY218_.jpg
"Laptop Computer 8GB RAM 256GB SSD, Laptop With Pentium Processor (Up to 3.4GHz, Beats N5095), 15.6 Inch FHD Display, Long Battery Life, Type-c, WiFi 5, BT 5.2, Laptops for Business and Students.",,4.8,https://m.media-amazon.com/images/I/710WM6fO8YL._AC_UY218_.jpg
"15.6"" Laptop Computer, Laptop with 16GB RAM 512B SSD, Gold 6500Y (Up to 3.4GHz), 1080P FHD IPS Display, Type-C, HDMI, USB3.2, WIFI, Bluetooth, Long Battery Life, Laptops for Business & Student",,4.8,https://m.media-amazon.com/images/I/71QXt+DXSlL._AC_UY218_.jpg
"ASUS ROG Strix G18 (2025) Gaming Laptop, 18” 16:10 144Hz/3ms, NVIDIA® GeForce RTX™ 5060, AMD Ryzen™ 9 9955HX Processor, 16GB DDR5-5600, 2TB PCIe Gen 4 SSD, Wi-Fi 6E, Windows 11 Home, G814FM-DS95",1025772.0,5.0,https://m.media-amazon.com/images/I/61N9qYL9TDL._AC_UY218_.jpg
"acer Nitro V Gaming Laptop | Intel Core i5-13420H Processor | NVIDIA GeForce RTX 4050 Laptop GPU | 15.6"" FHD IPS 144Hz Display | 8GB DDR5 | 512GB Gen 4 SSD | WiFi 6 | Backlit KB | ANV15-51-51H9",382022.0,4.2,https://m.media-amazon.com/images/I/71F-Wcriq4L._AC_UY218_.jpg
"Microsoft Surface Laptop 6 13.5"" Touchscreen Notebook - Intel Core Ultra 7 165H - 32 GB - 512 GB SSD - English Keyboard - Black",,4.4,https://m.media-amazon.com/images/I/51l1Dvj-5fL._AC_UY218_.jpg
"HP Chromebook 14"" HD Laptop for Business & Students, Intel Celeron N4120, 4GB LPDDR4, 224GB Storage(64GB eMMC+160GB Docking Station), UHD Graphics, Webcam, Long Battery Life, Chrome OS, Modern Gray",124866.0,4.3,https://m.media-amazon.com/images/I/81Wg83785AL._AC_UY218_.jpg
"acer Chromebook Plus 515 Laptop with Google AI – 15.6"" Full HD 1920 x 1080 IPS Touch Display | Intel Core i3-1305U | 8GB LPDDR5X | 256GB SSD | Wi-Fi 6E | FHD Camera | Chrome OS | CB515-2HT-33M4",216666.0,4.3,https://m.media-amazon.com/images/I/71IaMCkUciL._AC_UY218_.jpg
"Lenovo Yoga 7i 2-in-1 Laptop, 16"" 2K Touchscreen Display, Core Ultra 7 155U (Up to 4.80 GHz), 16GB DDR5, 1TB PCIe SSD, Wi-Fi 6E, Backlit KB, FP Reader, TB 4, Webcam, Keypad, PDG HDMI, Win 11 Pro",,4.4,https://m.media-amazon.com/images/I/61g8sLDDvdL._AC_UY218_.jpg
"Lenovo IdeaPad Slim 3i 15.6"" FHD Touchscreen Laptop, 13th Gen Intel 10-Core i7-1355U, 16GB LPDDR5 RAM, 1TB SSD, Intel Iris Xe Graphics, Backlit Keyboard, Wi-Fi 6, Win 11, Artic Grey, EAT 16GB USB Pen",,4.0,https://m.media-amazon.com/images/I/71QMBDR5t+L._AC_UY218_.jpg
"HP 15 Laptop, AMD Ryzen 3-5300U Processor, 8 GB RAM, 256 GB SSD Storage, 15.6-inch HD Micro-Edge Display, Windows 11 Home, Long-Lasting Battery, Fast Charge, 720p Webcam (15-ef2024nr), Natural Silver",,4.3,https://m.media-amazon.com/images/I/61xwWfWiOSL._AC_UY218_.jpg
ASUS 2025 Vivobook S 15.6” 3K 120Hz OLED Laptop 12-Core AMD Ryzen AI 9 HX 370 AMD Radeon 890M Graphics 32GB LPDDR5 1TB NVMe SSD USB-C WiFi AX BT Webcam HDMI2.1 RGB Backlit KB Windows 11 Home,,3.0,https://m.media-amazon.com/images/I/61+g3PpUu9L._AC_UY218_.jpg
"Dell Alienware 18 Area-51 Gaming Laptop 18"" 2.5K WQXGA Anti-Glare Display (Intel Ultra 9 275HX, GeForce RTX 5090, 64GB DDR5, 2TB PCIe SSD, Wi-Fi 7, Backlit KYB, Bluetooth 5.4, Windows 11 Home)",,4.5,https://m.media-amazon.com/images/I/61VUrc4sn7L._AC_UY218_.jpg
"HP Victus 15 Intel i5-13420H (Beats Intel i7-12650H), NVIDIA RTX 4050 Gaming Laptop, 15.6 FHD 144Hz IPS, 32GB RAM, 1TB SSD, Wi-Fi 6, Backlit KB, Win11 Home, Bundle with PCO Notebook Folding Radiator",,4.3,https://m.media-amazon.com/images/I/71riyTtAH6L._AC_UY218_.jpg
"Lenovo ThinkPad E16 Gen 3 16"" FHD+ Business Laptop Computer, Intel 16-Core Ultra 7 255H (Beat i9-13900H), Arc 140T, 32GB DDR5 RAM, 1TB PCIe SSD, WiFi 6E, Bluetooth 5.3, Webcam, Windows 11 Pro",,4.5,https://m.media-amazon.com/images/I/71kWN8S7soL._AC_UY218_.jpg
"ASUS Vivobook 15 Laptop: 15.6"" Full HD Display, Latest Generation Intel Core 5 120U, 16GB RAM, 512GB SSD, Wi-Fi 6, Windows 11 Home, Silver",,4.2,https://m.media-amazon.com/images/I/51hrUyRnU1L._AC_UY218_.jpg
"ASUS Chromebook Flip CX1 Convertible Laptop, 14"" FHD NanoEdge 360-degree Touchscreen, Intel Celeron N4500 Processor, 128GB eMMC Storage, 8GB RAM, ChromeOS, Transparent Silver, CX1400FKA-AS88FT",198996.0,4.4,https://m.media-amazon.com/images/I/61jEU25zSaL._AC_UY218_.jpg
"Lenovo 2026 New V15 Business and Student Laptop, Ryzen 3 7320U(Outperforms Intel i7-1065G7), 16GB RAM, 512GB SSD, 15.6"" FHD, Ultra Quiet Design, Long Battery Life, Wi-Fi 6, Bluetooth 5, Windows 11 Pro",,5.0,https://m.media-amazon.com/images/I/71NMsfRg4uL._AC_UY218_.jpg
"Acer Nitro 5 AN515-58-57Y8 Gaming Laptop | Intel Core i5-12500H | NVIDIA GeForce RTX 3050 Ti Laptop GPU | 15.6"" FHD 144Hz IPS Display | 16GB DDR4 | 512GB Gen 4 SSD | Killer Wi-Fi 6 | Backlit Keyboard",513165.0,4.5,https://m.media-amazon.com/images/I/71ctRE34RuL._AC_UY218_.jpg
"Dell 2023 Inspiron 15 Business Laptop, 15.6"" 1920x1080 FHD, 12th Gen Intel i5-1235U 4.4 GHz,16G RAM, 512G SSD, Win 11 Pro, Webcam, Bluetooth, Carbon Black",270840.0,4.2,https://m.media-amazon.com/images/I/51cSRFl4eIL._AC_UY218_.jpg
"MSI Titan 18 HX AI 18"" 120Hz MiniLED UHD+ Gaming Laptop: Intel Ultra 9-285HX, NVIDIA Geforce RTX 5090, 64GB DDR5, 6TB NVMe SSD, Thunderbolt 5, Wi-Fi 7, Win 11 Pro: Black A2XWJG-614US",,4.6,https://m.media-amazon.com/images/I/71MMe+kOxSL._AC_UY218_.jpg
HP Victus 15.6 inch FHD 144Hz Gaming Laptop | Intel Core i5-13420H | NVIDIA GeForce RTX 4050 6GB | Backlit | Mica Silver| 16GB RAM | 512GB SSD | Windows 11 Home | Bundle with USB 3.0 Hub,,5.0,https://m.media-amazon.com/images/I/61Tr3Br4tOL._AC_UY218_.jpg
"ASUS ROG Zephyrus G14 Latest (2025) 14"" 3K OLED 120Hz Gaming Laptop Copilot+ PC AMD Ryzen AI 9 HX 370 NVIDIA RTX 5070 Ti 12GB 32GB LPDDR5X RAM 1TB SSD RGB KB Windows 11 Platinum White",,3.4,https://m.media-amazon.com/images/I/412R6t8W9ZL._AC_UY218_.jpg
"ASUS TUF Gaming A15 Gaming Laptop, 15.6” FHD 144Hz Display, NVIDIA® GeForce RTX™ 3050, AMD Ryzen™ 5 7535HS, 8GB DDR5, 512GB PCIe® Gen4 NVMe™ SSD, Wi-Fi 6, Windows 11, FA506NC-ES51",421935.0,4.3,https://m.media-amazon.com/images/I/810dOSOM4-S._AC_UY218_.jpg
LG-gram Laptop-17 inch Touchscreen 2.5K - Intel Core Ultra 7 Processor - 32GB RAM -2TB PCIe SSD -Windows 11 -Backlit Keyboard - 2025 AI PC Copilot -Ultra Thin Lightweight -Business Work,,4.4,https://m.media-amazon.com/images/I/71lX-n34cVL._AC_UY218_.jpg
"msi Cyborg A15 AI 15.6” FHD 144Hz Thin & Light Gaming Laptop – Ryzen 7 260, GeForce RTX 5060, 16GB DDR5, 1TB SSD, Portable Design, Wi-Fi 6E, Windows 11 B2HWEKG-074US",668354.0,4.2,https://m.media-amazon.com/images/I/71m-C4TU-0L._AC_UY218_.jpg
"MSI Titan 18 HX AI A2XWJG-640CA 18"" UHD+ 120Hz Mini LED Gaming Laptop, Intel® Core™ Ultra 9-285HX, RTX 5090, 64GB DDR5 Memory, 2TB Gen5+ 2TB Gen4*2 NVMe SSD, Cherry Mechanical RGB KB, Win 11 Pro",,,https://m.media-amazon.com/images/I/71rzJZMnTvL._AC_UY218_.jpg
"ASUS ROG Strix G16 (2025) Gaming Laptop, 16” ROG Nebula 16:10 2.5K 240Hz/3ms, NVIDIA® GeForce RTX™ 5070 Ti, AMD Ryzen™ 9 9955HX3D Processor, 32GB DDR5-5600, 1TB PCIe Gen 4 SSD, Wi-Fi 6E, Win 11 Home",1424905.0,4.0,https://m.media-amazon.com/images/I/71O4ovzETDL._AC_UY218_.jpg
"HP Omen 17.3"" 144Hz FHD (1920x1080) IPS Laptop 2025 New | AMD Ryzen AI 9 365 10-Core | NVIDIA GeForce RTX 5060 | Single-Zone RGB Backlit Keyboard | Wi-Fi 6E | 32GB DDR5 1TB SSD | Win11 Home",,,https://m.media-amazon.com/images/I/71sRa2Jz3fL._AC_UY218_.jpg
"Lenovo Legion Pro 7i Gen 10 16"" Gaming Laptop (2025 Model) Intel Core Ultra 9 275HX 24C, NVIDIA GeForce RTX 5080 16GB, 32GB RAM, 1TB Gen 5 NVMe SSD, 16.0"" WQXGA OLED 500 nits 240Hz, Windows 11 Pro",1481924.0,4.2,https://m.media-amazon.com/images/I/515W50hwJmL._AC_UY218_.jpg
"Microsoft 2024 Surface Laptop 7th Edition, Copilot+ PC, 13.8in Snapdragon X-Elite 16GB RAM 1TB SSD Win 11H Black (Renewed)",,,https://m.media-amazon.com/images/I/61Et9hmmK3L._AC_UY218_.jpg
"Lenovo Yoga 7i 2-in-1 Laptop, 16"" 2K Touchscreen Laptop AI Copilot, Intel Core Ultra 5 226V, 16GB DDR5, 512GB SSD, Wi-Fi 7, Backlit KB, FP Reader, TB4, IR Camera, w/Stylus Pen, HDMI Cable, Win 11 Pro",,4.6,https://m.media-amazon.com/images/I/61-RC5FyCHL._AC_UY218_.jpg
"MSI GF63 Thin Gaming Laptop, 15.6"" FHD 144Hz, Intel i5-11400H, RTX 3050, 16GB RAM, 512GB NVMe SSD, Windows 11, Aluminum Black",,4.4,https://m.media-amazon.com/images/I/61cIEFr3vHL._AC_UY218_.jpg
ASUS 2026 Vivobook 15.6” FHD IPS Touchscreen Laptop 10-Core Intel Core i7-1355U Iris Xe Graphics 16GB DDR4 1TB NVMe SSD USB-C WiFi AX BT Webcam HDMI1.4 Backlit KB Windows 11 Pro w/RE USB,,,https://m.media-amazon.com/images/I/418Qx8j-sOL._AC_UY218_.jpg
"ASUS Vivobook 16 Laptop, 16"" IPS (1920x1200) WUXGA Display, Intel i7-1355U, 10-Core, 16GB DDR4 RAM, 512GB PCIe SSD, BK, Black, Intel Iris Xe Graphics, Windows 11 Home, TWE Accessories",,,https://m.media-amazon.com/images/I/717nTLTT7TL._AC_UY218_.jpg
"acer Predator Helios Neo 16S AI Gaming Laptop 16"" 2560x1600 OLED 240Hz (100% DCI-P3) Intel 24-core Ultra 9 275HX 32GB RAM 1TB SSD GeForce RTX 5070 Ti DLSS4 (Up to 992 AI Tops) Win11 ICP Hub w/Copilot",,5.0,https://m.media-amazon.com/images/I/71Cdy3ZcnTL._AC_UY218_.jpg
Dell Pro 14 Plus PB14255 AMD Ryzen 5 PRO 230 16GB 512GBSSD 14FHD+Non-Touch IRCamera AMDRyzen 3Cell 65W Backlit kb Win11Pro,,5.0,https://m.media-amazon.com/images/I/51hH8+oxmwL._AC_UY218_.jpg
"HP Victus 15.6"" 144Hz Full HD Gaming Laptop | AMD Ryzen 7 7445HS |NVIDIA GeForce RTX 4050|Copilot |Backlit| 16GB RAM DDR5 | 512GB SSD |Mica Silver |Windows 11 Home |Bundle with Mouse Pad",455576.0,4.5,https://m.media-amazon.com/images/I/61iAblG3whL._AC_UY218_.jpg
"acer Predator Helios Neo 16 AI Gaming Laptop | Intel Core Ultra 9 Processor 275HX | NVIDIA GeForce RTX 5070 Ti | 16"" WQXGA 240Hz G-SYNC | 16GB DDR5 | 1TB Gen 4 SSD | Killer Wi-Fi 6E | PHN16-73-92B8",1083355.0,4.8,https://m.media-amazon.com/images/I/71S4zkAzSsL._AC_UY218_.jpg
"ASUS TUF Gaming A15 Gaming Laptop, 15.6” FHD 16:9 144Hz Display, AMD Ryzen™ 5 7535HS Processor, NVIDIA® GeForce RTX™ 3050, 16GB DDR5, 512GB PCIe® Gen 4.0 SSD, Wi-Fi 6, Windows 11 Home, FA506NC-DS53",570184.0,4.4,https://m.media-amazon.com/images/I/91aWfctUptL._AC_UY218_.jpg
"HP 2025/2026 New Envy x360 2-in-1 Laptop, Intel Core Ultra 5 125U (Up to 4.3GHz), 15.6"" FHD Touchscreen Display with Backlit Keyboard, 8GB DDR5, 512GB SSD, Thunderbolt 4, Wi-Fi 6E, Windows 11 Home",,5.0,https://m.media-amazon.com/images/I/71r5uNowykL._AC_UY218_.jpg
"Dell Latitude 5420 Rugged Laptop, 14 inches FHD (1920 x 1080) Non-Touch, Intel Core 8th Gen i5-8350U, 16GB (2x8GB) SDRAM RAM, 512GB SSD, Windows 11 Pro (Renewed)",370618.0,,https://m.media-amazon.com/images/I/61cNi-X4UXL._AC_UY218_.jpg
"Dell Latitude Rugged 5430 Laptop (2022) Touch | 14"" 1920x1080 FHD | Core i5-1135G7-256GB SSD Hard Drive - 32GB RAM | 4 cores @ 4.2 GHz Win 11 Pro Black",1043442.0,,https://m.media-amazon.com/images/I/61gweufcyXL._AC_UY218_.jpg
"Microsoft Surface Laptop Studio - 14.4"" Touchscreen - Intel® Core™ i7 - 16GB Memory - 512GB SSD - Platinum",,4.0,https://m.media-amazon.com/images/I/61UGE9cZVlL._AC_UY218_.jpg
"ASUS Vivobook 14 2026 Business Laptop 14"" FHD 10-Core Intel i7-1355U 24GB DDR4 1TB SSD Intel Iris Xe Graphics Wi-Fi 5 Win11 Pro w/ONT 32GB USB",,4.2,https://m.media-amazon.com/images/I/514F-bCZpLL._AC_UY218_.jpg
"Dell Pro 16 Plus PB16250 (Replaces Latitude 5550) AI Business Notebook 16"" FHD+ Intel Ultra 7-265U, 32GB DDR5 RAM, 1TB SSD PCIe, Wi-Fi 6E, BT, Backlit Keyboard, HD Webcam, RJ-45, Win 11 Pro - Silver",,1.5,https://m.media-amazon.com/images/I/71HZcJcZ+lL._AC_UY218_.jpg
"msi Stealth A16 AI+ 16” 240Hz QHD+ OLED Gaming Laptop: AMD Ryzen AI 9 HX 370, NVIDIA Geforce RTX 5090, 64GB DDR5, 2TB NVMe SSD, Wi-Fi 7, Win 11 Home :Core Black A3XWJG-074US",2331507.0,4.2,https://m.media-amazon.com/images/I/71jOI3BNTCL._AC_UY218_.jpg
"Dell Alienware 16X Aurora Gaming AI Laptop 16"" WQXGA 240Hz (100% DCI-P3) Intel 24-core Ultra 9 275HX 64GB RAM 2TB SSD GeForce RTX 5070 (Up to 798 AI Tops) Thunderbolt Win11Pro w/Copilot",,4.6,https://m.media-amazon.com/images/I/71bEyIVB45L._AC_UY218_.jpg
"MSI Stealth 18 HX AI 18” 120Hz UHD+ Gaming Laptop: Intel Ultra 9-275HX, NVIDIA Geforce RTX 5090, 64GB DDR5, 2TB NVMe SSD, Wi-Fi 7, Win 11 Pro: Black A2XWJG-035US",,4.1,https://m.media-amazon.com/images/I/71madPoggDL._AC_UY218_.jpg
"Lenovo Legion 7i Gen 10, AI Gaming Laptop, Intel Ultra 9 275HX, 16"" OLED 2.6K (2560x1600) 240Hz 500 nits, 32 GB DDR5, 2 TB SSD, NVIDIA RTX 5070, 5MP Camera E Shutter, Wi-Fi 7, Win 11 - Glacier White",,3.9,https://m.media-amazon.com/images/I/51y9G2pjl5L._AC_UY218_.jpg
"Dell Pro 14 Plus (Next Gen Latitude 7450) Business Laptop, 14"" FHD+, Intel Core Ultra 7 266V (> i9-13900H), 16GB 8533 MT/s RAM, 512GB SSD, 5G LTE, Wi-Fi 7, 1440P Webcam, AI Copilot + PC, Win 11 Pro",,5.0,https://m.media-amazon.com/images/I/71T+qycnX9L._AC_UY218_.jpg
"Dell Latitude 5520 Business Laptop, 15.6"" FHD Display, Intel Core i5-1135G7 vPRO, 16GB RAM, 512GB SSD, IR Camera, HDMI, Backlit Keyboard, Wi-Fi 6, RJ-45, Thunderbolt 4, Windows 11 Pro",,4.3,https://m.media-amazon.com/images/I/71lq44Ru6dL._AC_UY218_.jpg
"msi Titan AI Gaming Laptop 18"" 120Hz Mini LED 4K Display (Intel Ultra 9-285HX, GeForce RTX 5090 24GB, 64GB DDR5, 2x8TB PCIe SSD (16TB), Per Key RGB KB, Win 11 Pro) w/USB-C Dock",,5.0,https://m.media-amazon.com/images/I/61xjUAXxtkL._AC_UY218_.jpg
"HP 14 inch HD Laptop, Intel Dual Core CPU, 8GB RAM, 64GB eMMC, Lightweight & 12H Battery, Sleek Design with Multiple Ports, Webcam/Mic for Business/Students/Tourists, Microsoft 365 Included, LE Bundle",,4.4,https://m.media-amazon.com/images/I/71oGlnASNpL._AC_UY218_.jpg
"Lenovo 2025 ThinkPad T14 Gen 6 Co-Pilot+ Laptop - AMD Ryzen AI 5 PRO 340, 14” WUXGA 1920x1200 400 Nits Display, AI PC, 16GB Memory, 512 GB SSD, 5MP RGB Cam, FP Reader & Windows 11 Pro - 21QJ00CQUS",547377.0,,https://m.media-amazon.com/images/I/61zBCQBhnML._AC_UY218_.jpg
"Microsoft Surface Laptop Copilot+ PC 13.8"" Qualcomm Snapdragon X Plus (10 core) 2304 x 1536 Win 11 16GB/1TB EP2-06079",,,https://m.media-amazon.com/images/I/61IW8S9SYbL._AC_UY218_.jpg
"Lenovo Legion Pro High-Performance i9 Gaming Laptop, 16"" WQXGA 240Hz, Intel Core i9-14900HX, NVIDIA GeForce RTX 4090, 64GB DDR5 RAM, 4TB SSD, HDMI, RGB Backlit KB, Webcam, Wi-Fi 6, Win 11 Pro",,4.8,https://m.media-amazon.com/images/I/71lqSQ4FHTL._AC_UY218_.jpg
"Dell Inspiron 14 i5440 2024 Laptop, 10-Core Intel Core i5-1334U, 14"" WUXGA IPS Display, Intel Iris Xe Graphics, 16GB DDR5 512GB SSD, Backlit Keyboard, Wi-Fi 6, Win11 Pro",,,https://m.media-amazon.com/images/I/81mHreJh3JL._AC_UY218_.jpg
"LG gram Pro 17-inch Lightweight Laptop Computer, Intel Evo Edition Powered by Intel Core Ultra7 255H Processor, NVIDIA RTX5050, Windows 11 Home, 32GB RAM, 2TB SSD, Black",1366740.0,4.5,https://m.media-amazon.com/images/I/617zFnvYNlL._AC_UY218_.jpg
"LG gram 15-inch Thin and Lightweight Touchscreen Laptop, Windows 11 Home, AI-Enabled Intel Evo Edition Powered by Intel Core Ultra7(Series 2) 255H Processor, 16GB RAM, 1TB SSD, Obsidian Black",725521.0,4.3,https://m.media-amazon.com/images/I/61eKj1D2xnL._AC_UY218_.jpg
"jumper Laptop, 12GB RAM 640GB ROM, Office 365-1 Year 5205U Processor, 15.6 Inch Computer, FHD IPS Screen, 38Wh Battery, 2 Stereo Speakers, Numeric Keyboard, HDMI, WIFI5, Type-C.",,5.0,https://m.media-amazon.com/images/I/71h2a4vwv0L._AC_UY218_.jpg
"Lenovo IdeaPad 1 Laptop, 15.6” FHD Display, AMD Ryzen 5 5500U, 8GB RAM, 512GB SSD, Windows 11 Home, 720p Camera w/Privacy Shutter, Smart Noise Cancelling, Cloud Grey",256580.0,4.4,https://m.media-amazon.com/images/I/51h3oOo7XnL._AC_UY218_.jpg
"Dell Latitude 5450 Laptop 14"" FHD, Intel Core Ultra 7-155U, 16GB RAM, 512GB NVMe SSD, Webcam, Wi-Fi 6E, Bluetooth, Backlit Keyboard,Sim Slot, HDMI, USB C- Display Port, Windows 11 Pro, Notebook, Grey",,4.7,https://m.media-amazon.com/images/I/51KzcHsa33L._AC_UY218_.jpg
"Dell Precision 7780 Mobile Workstation - 17.3"" FHD AG Display Display - Intel Core i9-13950HX 24-Core (13th Gen) - 1TB SSD - 64GB DDR5 RAM - NV RTX 3500 ADA (12GB GDDR6) - Windows 11 pro",,5.0,https://m.media-amazon.com/images/I/61kUx8CNSiL._AC_UY218_.jpg
"HP 2026 Portable 15.6'' HD Laptop, Intel N Series Processor Up to 3.7GHz, 16GB Memory, 128GB Storage, Super-Fast 6th Gen WiFi, Windows 11 OS, Dale Silver, Renewed",,,https://m.media-amazon.com/images/I/71bSTJs1KyL._AC_UY218_.jpg
"ASUS TUF A16 Copilot+ Gaming Laptop, AMD Ryzen 9 270, 32 GB DDR5 RAM, 1 TB PCle SSD, 16"" FHD+ (1920x1200) 165Hz Display, Nvidia G-Force RTX 5070, 1-Zone RGB Keyboard, W11 Home, Jaegar Gray",,4.2,https://m.media-amazon.com/images/I/81ChL6T-PwL._AC_UY218_.jpg
"HP Portable Laptop, Student and Business, 14"" HD Display, Intel Quad-Core N4120, 16GB DDR4 RAM, 64GB eMMC, 1 Year Office 365, Webcam, RJ-45, HDMI, Wi-Fi, Windows 11 Home, Silver",148244.0,4.1,https://m.media-amazon.com/images/I/61IpRGnny7L._AC_UY218_.jpg
"Lenovo 2025 Copilot+ PC ThinkPad P14s Gen 6 Mobile Workstation with AMD Ryzen AI 9 HX PRO 370 Processor, 64GB DDR5 Memory, 1TB SSD, 14” WUXGA 500 nits 100% sRGB Non-Touch Display, WiFi 7, Win 11 Pro",,4.5,https://m.media-amazon.com/images/I/71TsJIChFTL._AC_UY218_.jpg
"Lenovo V15 Gen 4 Business Laptop, 15.6"" FHD Screen, 13th Gen Intel 10 Cores i7-1355U up to 5.0GHz, 16GB RAM, 1TB PCIe SSD, HD Camera with Privacy Shutter, Wi-Fi, HDMI, Windows 11 Pro, Black",,4.2,https://m.media-amazon.com/images/I/71Mu6zNl-SL._AC_UY218_.jpg
"Microsoft Surface Pro 2-in-1 Laptop/Tablet (2025), Windows 11 Copilot+ PC, 12"" Touchscreen Display, Snapdragon X Plus (8 Core), 16GB RAM, 256GB Storage, Platinum",,4.4,https://m.media-amazon.com/images/I/61HPhDS+iaL._AC_UY218_.jpg
"ASUS Chromebook CM14 Laptop, 14"" HD Anti-Glare Display (1366x768), MediaTek Kompanio 520, 4GB RAM, 64GB eMMC, ChromeOS, Gray, CM1402CM2A-DS44, Gravity Grey",96932.0,4.2,https://m.media-amazon.com/images/I/616aCuRtnpL._AC_UY218_.jpg
"ASUS TUF A18 Gaming Laptop - AMD Ryzen 7 260 Beat i9-13905H - NVIDIA RTX 5060-64GB RAM -2TB SSD -18"" WUXGA Display - RGB Backlit Keyboard -Windows 11 -FHD Camera -Gamer Creative Videao Editing",1185989.0,5.0,https://m.media-amazon.com/images/I/71t8vSC+edL._AC_UY218_.jpg
"acer Aspire 14 AI Copilot+ PC | 14"" WUXGA Display | Intel Core Ultra 7 Processor 256V | NPU: Up to 47 Tops - GPU: Up to 64 Tops | Intel ARC 140V | 16GB LPDDR5X | 1TB SSD | Wi-Fi 6E | A14-52M-72S0",379171.0,4.8,https://m.media-amazon.com/images/I/71rS15Jj8OL._AC_UY218_.jpg
"HP 15.6"" HD Touch Screen Laptop | Intel Core i3-1215U (6 Cores, 8 Threads) | Intel UHD Graphics | Silver | 8GB RAM | 256GB SSD | Windows 11 S | Bundle with Stylus Pen",193865.0,4.3,https://m.media-amazon.com/images/I/518FIYxlS2L._AC_UY218_.jpg
"ASUS Chromebook CX1700 17.3"" FHD Laptop, Intel Celeron N4500 Processor, 4GB RAM, 128GB eMMC Flash Memory, Intel UHD Graphics, 720P Webcam, Wi-Fi 6, Bluetooth, Chrome OS, Gray (Renewed)",,4.2,https://m.media-amazon.com/images/I/818r9sfaGyL._AC_UY218_.jpg
"Lenovo IdeaPad 1 14 Laptop, 14.0"" HD Display, Intel Celeron N4020, 4GB RAM, 64GB Storage, Intel UHD Graphics 600, Win 11 in S Mode, Cloud Grey",96362.0,3.9,https://m.media-amazon.com/images/I/71bphKmt0DL._AC_UY218_.jpg
"Lenovo ThinkPad E16 Gen 1 Business Laptop 16.0"" WUXGA IPS Display 300 nits (AMD Ryzen 5 7530U 6-Core 2.00GHz, 16GB RAM, 512GB PCIe SSD, AMD Radeon, Backlit KYB, FP, WiFi 6, Win11Pro) w/Dockztorm Hub",409961.0,4.6,https://m.media-amazon.com/images/I/612kE4aAHNL._AC_UY218_.jpg
"HP 17.3"" FHD IPS Laptop, Quad Core AMD Ryzen 5 7520U (Beat i7-1255U) 8GB DDR5 RAM 512GB SSD, Business-Student Laptop with Copilot AI Fast Charge Private Webcam Wifi6 Win11, w/GM Accessory",,4.4,https://m.media-amazon.com/images/I/71kvMwBGQxL._AC_UY218_.jpg
"HP - Stream 11.6"" Laptop - Intel Celeron - 4GB Memory - 64GB eMMC Flash Memory - Diamond White",,4.3,https://m.media-amazon.com/images/I/81+7HVdlqIL._AC_UY218_.jpg
"HP 14"" HD Student Laptop, Intel Celeron N4500, 4GB DDR4 RAM, 64GB eMMC, Intel UHD Graphics, 720p HD Camera, Copilot, Fast Charge, Wi-Fi 6, Windows 11S, White (Renewed)",,4.1,https://m.media-amazon.com/images/I/81M1bOGzxcL._AC_UY218_.jpg
"Dell Latitude 7410 Laptop | 14"" 1920x1080 FHD | Core i7-10610U - 256GB SSD Hard Drive - 16GB RAM | 4 cores @ 4.9 GHz Win 11 Pro Black (Renewed)",,4.4,https://m.media-amazon.com/images/I/61ilOv4xb3S._AC_UY218_.jpg
"ASUS Chromebook CX15 Laptop, 15.6"" FHD Anti-Glare Display, Intel Celeron N4500 Processor, 128GB Storage, 8GB RAM, ChromeOS, Pure Grey, CX1505CKA-AS88F-PG",150861.0,4.3,https://m.media-amazon.com/images/I/71SP8bVXbNL._AC_UY218_.jpg
"HP Stream 14"" Micro-Edge HD Touchscreen Laptop, Intel Celeron N4020, 8GB RAM, 64GB eMMC, Wi-Fi 5, Bluetooth, Windows 11, Blue (Renewed)",,5.0,https://m.media-amazon.com/images/I/81gm5ZnHy4L._AC_UY218_.jpg
"Laptop 32GB RAM 1TB SSD, Gold Pentium Processor (Up to 3.4GHz), 14 Inch IPS FHD Display, 38WH, USB3.2, Type-C, HDMI, WiFi 5, Win11 Laptop, Notebook Laptops for Business and Students",176183.0,5.0,https://m.media-amazon.com/images/I/61kvVM7uEaL._AC_UY218_.jpg
"Laptop, 32GB RAM 1TB SSD Laptop Computer, 6500Y Processor (Beats N5095, Up to 3.4GHz), 15.6 inch FHD IPS Display, Type-C, HDMI, WiFi 5, BT 5.2, Laptops for Student, Business, Travel",181891.0,5.0,https://m.media-amazon.com/images/I/61NWHv4OlLL._AC_UY218_.jpg
"ASUS Zenbook S 16 Laptop, AMD Ryzen AI 9 365, 24 GB DDR5 RAM, 1 TB PCIe SSD, 16” 3K Touch Screen (2880x1800), AMD Radeon 880M, W11 Home",735539.0,4.2,https://m.media-amazon.com/images/I/61oltDX2ZeL._AC_UY218_.jpg
"Dell 16 Laptop Touchscreen Business Computer - Intel 10-Core 7 150U(up to 5.4GHz), 16'' FHD+ Touch Dsiaplay, Backlit KB, Fingerprint, Windows 11 pro, 32GB DDR5 RAM, 1TB SSD",,3.7,https://m.media-amazon.com/images/I/71su1jsDnkL._AC_UY218_.jpg
"HP 15.6"" HD Chromebook Laptop, Intel Processor N200, 8GB LPDDR5, 224GB Storage (64GB eMMC+160GB Docking Station Set), Intel UHD Graphics, HD 720p Webcam, Numeric Keypad, Wi-Fi 6, Chrome OS, Silver",170487.0,4.5,https://m.media-amazon.com/images/I/81uQWXz4ieL._AC_UY218_.jpg
Dell 16 Touchscreen Laptop -AMD Ryzen Ryzen 7 250 Beat Ultra 7 155H -16inch FHD+ Touch -32GB RAM| 1TB SSD -Backlit Keyboard -Office 365 -Windows 11 -Copilot Laptop Portatil PC- Business College,541675.0,5.0,https://m.media-amazon.com/images/I/71006Mu4w-L._AC_UY218_.jpg
"2026 New 15.6'' Laptop Windows 11 Pro, Intel Core i3-6100U (Max 3.4GHz), 8GB RAM, 256GB SSD, 1080p, FHD Display, Backlit Kerboard, Fingerprint, WiFi5, BT5, Webcam, Mini-HDMI, USB3.2 Gen1, TF Card Slot",125436.0,3.8,https://m.media-amazon.com/images/I/6195wxVpySL._AC_UY218_.jpg
"Lenovo Ideapad 3 Laptop, 15.6"" HD Touchscreen Display, 11th Gen Intel Core i3-1115G4 Processor, 12GB DDR4 RAM, 512GB PCIe SSD, Bluebooth, Webcam, Wi-Fi, HDMI, Windows 11 Home, Grey",,4.3,https://m.media-amazon.com/images/I/61eFMUYS+HL._AC_UY218_.jpg
"acer Aspire 5 15 Slim Laptop | 15.6"" FHD IPS Touch 1920 x 1080 | Intel Core i7-1355U | Intel Iris Xe Graphics | 16GB LPDDR5 | 512GB Gen 4 SSD | Wi-Fi 6E 802.11ax | Backlit Keyboard |",342108.0,4.2,https://m.media-amazon.com/images/I/71JJlkLRNYL._AC_UY218_.jpg
"ASUS 15.6” Vivobook Go Slim Laptop, Thin & Portable for Student Study, Intel Dual Core N4500, 4GB RAM, 128GB SSD, Windows 11, Star Black, L510KA-ES04",141977.0,3.9,https://m.media-amazon.com/images/I/61KZBt8QeGL._AC_UY218_.jpg
"GEEKOM GeekBook X16 Pro 2.8 lbs Laptop, 16"" IPS 2.5K 16:10 Laptop Computer, Ultra 9 185H, 32GB LPDDR5x 7500MHz RAM 2TB SSD, Up to 17 Hour, USB4, Fingerprint, Dual Fan, Copilot, Windows 11 Pro",,4.6,https://m.media-amazon.com/images/I/71iHXk9MSLL._AC_UY218_.jpg
"Laptop, 32GB RAM 512GB SSD Laptops Computer, 6500Y Processor (Beats N5095 up to 3.4GHz), 15.6"" FHD IPS Display Win11 Laptop PC for Student and Business, WiFi 5, BT 5.0, Sliver",,4.0,https://m.media-amazon.com/images/I/61aJ5UrozjL._AC_UY218_.jpg
"Lenovo Legion Pro 7i 16"" WQXGA OLED Glossy 240Hz, Gaming Laptop - Eclipse Black, Intel Core Ultra 9 275HX 2.1GHz; NVIDIA GeForce RTX 5090 24GB GDDR7; 64GB DDR5 RAM; 2X 1TB NVMe SSD, Windows 11 Pro",,4.5,https://m.media-amazon.com/images/I/71FZu3aAaqL._AC_UY218_.jpg
"acer Nitro V Gaming Laptop | Intel Core i9-13900H Processor | NVIDIA GeForce RTX 4060 Laptop GPU | 15.6"" FHD IPS 144Hz Display | 32GB DDR5 | 1TB Gen 4 SSD | WiFi 6 | Backlit KB | ANV15-51-92XK",769751.0,4.0,https://m.media-amazon.com/images/I/71F-Wcriq4L._AC_UY218_.jpg
"ASUS TUF Gaming A16 Laptop: AMD Ryzen 7 7445HS, 16"" Full HD+ 145Hz Display, NVIDIA GeForce RTX 4050, 16GB DDR5 RAM, 512GB SSD, Backlit Keyboard, Windows 11",,4.5,https://m.media-amazon.com/images/I/61WVG2Fd76L._AC_UY218_.jpg
